{
  "$schema": "../../brand-system-spec/v1/schemas/brand.schema.json",
  "schemaVersion": "1.0.0",
  "packageVersion": "1.0.0",
  "brand": {
    "id": "motosport",
    "name": "MotoSport",
    "description": "High-energy powersports commerce combining blue fitment utility, red racing signals, and condensed Saira headlines.",
    "proposition": "Parts, gear, tires, OEM components, and fitment guidance for dirt bike, motorcycle, ATV, and UTV riders.",
    "audiences": [
      "Dirt bike and motocross riders",
      "Street motorcycle riders",
      "ATV and UTV owners",
      "Customers maintaining or upgrading specific vehicles"
    ],
    "traits": [
      "fast",
      "mechanical",
      "confident",
      "fitment-led",
      "racing",
      "serviceable"
    ],
    "signature": "Ride-specific selection",
    "voiceSummary": "Direct powersports expertise. Lead with machine, fitment, part, safety, and riding outcome."
  },
  "files": {
    "tokens": "tokens.json",
    "rules": "rules.json",
    "recipes": "recipes.json",
    "media": "media.json",
    "evaluation": "evaluation.json",
    "humanGuide": "DESIGN.md"
  },
  "modules": [
    {
      "capability": "interactive",
      "path": "modules/interactive.json"
    },
    {
      "capability": "static",
      "path": "modules/static.json"
    },
    {
      "capability": "imagery",
      "path": "modules/imagery.json"
    },
    {
      "capability": "commerce",
      "path": "modules/commerce.json"
    },
    {
      "capability": "marketing",
      "path": "modules/marketing.json"
    },
    {
      "capability": "motion",
      "path": "modules/motion.json"
    },
    {
      "capability": "generative-image",
      "path": "modules/generative-image.json"
    },
    {
      "capability": "generative-video",
      "path": "modules/generative-video.json"
    },
    {
      "capability": "spatial",
      "path": "modules/spatial.json"
    },
    {
      "capability": "sequential",
      "path": "modules/sequential.json"
    }
  ],
  "provenance": {
    "researchedAt": "2026-07-21",
    "method": "First-party live or archived surface review, computed-style sampling, visible component inspection, and official or public asset capture.",
    "evidenceStatus": "mixed",
    "verifiedSurfaces": [
      "current-homepage"
    ],
    "sourceAudit": "../../research/portfolio-live-evidence.json",
    "historicalStandaloneIdentity": false,
    "notes": [
      "Rendered live homepage audit and computed first-party styles.",
      "Current offers, inventory, prices, availability, service scope, and campaign copy are runtime data.",
      "The package is output-neutral; provider and renderer adapters belong outside it."
    ]
  }
}
