{
  "$schema": "../../brand-system-spec/v1/schemas/brand.schema.json",
  "schemaVersion": "1.0.0",
  "packageVersion": "1.0.0",
  "brand": {
    "id": "steep-and-cheap",
    "name": "Steep & Cheap",
    "description": "Deal-driven outdoor retail with a bright green action system, Sofia Pro, and compact urgency.",
    "proposition": "Fast access to notable outdoor-brand deals and past-season gear for value-driven customers.",
    "audiences": [
      "Deal-seeking outdoor customers",
      "Experienced shoppers who know product categories",
      "Seasonal gear buyers",
      "Customers willing to act on limited inventory"
    ],
    "traits": [
      "scrappy",
      "immediate",
      "clear",
      "outdoorsy",
      "value-led",
      "trustworthy"
    ],
    "signature": "The deal is the point",
    "voiceSummary": "Fast, candid value language that states the product and verified savings without manufactured drama."
  },
  "files": {
    "tokens": "tokens.json",
    "rules": "rules.json",
    "recipes": "recipes.json",
    "media": "media.json",
    "evaluation": "evaluation.json",
    "humanGuide": "DESIGN.md"
  },
  "modules": [
    {
      "capability": "interactive",
      "path": "modules/interactive.json"
    },
    {
      "capability": "static",
      "path": "modules/static.json"
    },
    {
      "capability": "imagery",
      "path": "modules/imagery.json"
    },
    {
      "capability": "commerce",
      "path": "modules/commerce.json"
    },
    {
      "capability": "marketing",
      "path": "modules/marketing.json"
    },
    {
      "capability": "motion",
      "path": "modules/motion.json"
    },
    {
      "capability": "generative-image",
      "path": "modules/generative-image.json"
    },
    {
      "capability": "generative-video",
      "path": "modules/generative-video.json"
    },
    {
      "capability": "spatial",
      "path": "modules/spatial.json"
    },
    {
      "capability": "sequential",
      "path": "modules/sequential.json"
    }
  ],
  "provenance": {
    "researchedAt": "2026-07-21",
    "method": "First-party live or archived surface review, computed-style sampling, visible component inspection, and official or public asset capture.",
    "evidenceStatus": "mixed",
    "verifiedSurfaces": [
      "current-homepage",
      "first-party-linked-social-profiles"
    ],
    "sourceAudit": "../../research/portfolio-live-evidence.json",
    "historicalStandaloneIdentity": false,
    "notes": [
      "Live site returned human verification; values come from the first-party archived Chakra theme.",
      "Current offers, inventory, prices, availability, service scope, and campaign copy are runtime data.",
      "The package is output-neutral; provider and renderer adapters belong outside it."
    ]
  }
}
