{
  "$schema": "../../brand-system-spec/v1/schemas/brand.schema.json",
  "schemaVersion": "1.0.0",
  "packageVersion": "1.0.0",
  "brand": {
    "id": "home-consignment-center",
    "name": "Home Consignment Center",
    "description": "Bold upscale consignment retail combining gallery-scale imagery, navy depth, and decisive red actions.",
    "proposition": "A local destination for discovering and consigning distinctive furniture, decor, art, and jewelry with constantly changing inventory.",
    "audiences": [
      "Homeowners seeking distinctive furnishings",
      "Sellers consigning quality home goods or jewelry",
      "Local design shoppers",
      "Value-conscious premium and vintage shoppers"
    ],
    "traits": [
      "bold",
      "upscale",
      "local",
      "approachable",
      "discovery-led",
      "trustworthy"
    ],
    "signature": "Find it. Love it. Give it a new home.",
    "voiceSummary": "Energetic local retail confidence with clear consignment guidance and no false permanence about one-of-a-kind inventory."
  },
  "files": {
    "tokens": "tokens.json",
    "rules": "rules.json",
    "recipes": "recipes.json",
    "media": "media.json",
    "evaluation": "evaluation.json",
    "humanGuide": "DESIGN.md"
  },
  "modules": [
    {
      "capability": "interactive",
      "path": "modules/interactive.json"
    },
    {
      "capability": "static",
      "path": "modules/static.json"
    },
    {
      "capability": "imagery",
      "path": "modules/imagery.json"
    },
    {
      "capability": "commerce",
      "path": "modules/commerce.json"
    },
    {
      "capability": "marketing",
      "path": "modules/marketing.json"
    },
    {
      "capability": "motion",
      "path": "modules/motion.json"
    },
    {
      "capability": "generative-image",
      "path": "modules/generative-image.json"
    },
    {
      "capability": "generative-video",
      "path": "modules/generative-video.json"
    },
    {
      "capability": "spatial",
      "path": "modules/spatial.json"
    },
    {
      "capability": "sequential",
      "path": "modules/sequential.json"
    }
  ],
  "provenance": {
    "researchedAt": "2026-07-21",
    "method": "First-party live or archived surface review, computed-style sampling, visible component inspection, and official or public asset capture.",
    "evidenceStatus": "mixed",
    "verifiedSurfaces": [
      "current-homepage"
    ],
    "sourceAudit": "../../research/portfolio-live-evidence.json",
    "historicalStandaloneIdentity": false,
    "notes": [
      "Rendered live homepage, computed styles, and exposed Elementor/Astra variables.",
      "Current offers, inventory, prices, availability, service scope, and campaign copy are runtime data.",
      "The package is output-neutral; provider and renderer adapters belong outside it."
    ]
  }
}
