{
  "$schema": "../../brand-system-spec/v1/schemas/brand.schema.json",
  "schemaVersion": "1.0.0",
  "packageVersion": "1.0.0",
  "brand": {
    "id": "bike-tires-direct",
    "name": "BikeTiresDirect",
    "description": "Dense enthusiast cycling retail with navy utility chrome, red promotions, and gold deal accents.",
    "proposition": "Broad cycling selection, visible value, and practical product detail for riders who want to compare and buy efficiently.",
    "audiences": [
      "Everyday and enthusiast cyclists",
      "Value-conscious component shoppers",
      "Riders maintaining multiple bicycles",
      "Customers who prefer dense product comparison"
    ],
    "traits": [
      "practical",
      "dense",
      "trustworthy",
      "deal-aware",
      "enthusiast",
      "efficient"
    ],
    "signature": "Selection and value made visible",
    "voiceSummary": "Straightforward cycling retail language with concrete pricing, compatibility, and availability context."
  },
  "files": {
    "tokens": "tokens.json",
    "rules": "rules.json",
    "recipes": "recipes.json",
    "media": "media.json",
    "evaluation": "evaluation.json",
    "humanGuide": "DESIGN.md"
  },
  "modules": [
    {
      "capability": "interactive",
      "path": "modules/interactive.json"
    },
    {
      "capability": "static",
      "path": "modules/static.json"
    },
    {
      "capability": "imagery",
      "path": "modules/imagery.json"
    },
    {
      "capability": "commerce",
      "path": "modules/commerce.json"
    },
    {
      "capability": "marketing",
      "path": "modules/marketing.json"
    },
    {
      "capability": "motion",
      "path": "modules/motion.json"
    },
    {
      "capability": "generative-image",
      "path": "modules/generative-image.json"
    },
    {
      "capability": "generative-video",
      "path": "modules/generative-video.json"
    },
    {
      "capability": "spatial",
      "path": "modules/spatial.json"
    },
    {
      "capability": "sequential",
      "path": "modules/sequential.json"
    }
  ],
  "provenance": {
    "researchedAt": "2026-07-21",
    "method": "First-party live or archived surface review, computed-style sampling, visible component inspection, and official or public asset capture.",
    "evidenceStatus": "mixed",
    "verifiedSurfaces": [
      "current-homepage",
      "first-party-linked-social-profiles"
    ],
    "sourceAudit": "../../research/portfolio-live-evidence.json",
    "historicalStandaloneIdentity": false,
    "notes": [
      "Rendered live homepage audit and first-party CSS variables.",
      "Current offers, inventory, prices, availability, service scope, and campaign copy are runtime data.",
      "The package is output-neutral; provider and renderer adapters belong outside it."
    ]
  }
}
