{
  "$schema": "../../brand-system-spec/v1/schemas/brand.schema.json",
  "schemaVersion": "1.0.0",
  "packageVersion": "1.0.0",
  "brand": {
    "id": "western-bikeworks",
    "name": "Western Bikeworks",
    "description": "Legacy enthusiast cycling retail with red, Portland teal, orange value accents, and compact Open Sans UI.",
    "proposition": "A historically local, practical cycling-retail identity centered on dependable gear, service, and ride utility.",
    "audiences": [
      "Pacific Northwest riders",
      "Commuters and recreational cyclists",
      "Cycling customers seeking local service",
      "Value-conscious component shoppers"
    ],
    "traits": [
      "local",
      "practical",
      "dependable",
      "cycling-led",
      "service-minded",
      "unfussy"
    ],
    "signature": "Local ride utility",
    "voiceSummary": "Straightforward local cycling help with product, route, weather, and maintenance context."
  },
  "files": {
    "tokens": "tokens.json",
    "rules": "rules.json",
    "recipes": "recipes.json",
    "media": "media.json",
    "evaluation": "evaluation.json",
    "humanGuide": "DESIGN.md"
  },
  "modules": [
    {
      "capability": "interactive",
      "path": "modules/interactive.json"
    },
    {
      "capability": "static",
      "path": "modules/static.json"
    },
    {
      "capability": "imagery",
      "path": "modules/imagery.json"
    },
    {
      "capability": "commerce",
      "path": "modules/commerce.json"
    },
    {
      "capability": "marketing",
      "path": "modules/marketing.json"
    },
    {
      "capability": "motion",
      "path": "modules/motion.json"
    },
    {
      "capability": "generative-image",
      "path": "modules/generative-image.json"
    },
    {
      "capability": "generative-video",
      "path": "modules/generative-video.json"
    },
    {
      "capability": "spatial",
      "path": "modules/spatial.json"
    },
    {
      "capability": "sequential",
      "path": "modules/sequential.json"
    }
  ],
  "provenance": {
    "researchedAt": "2026-07-21",
    "method": "First-party live or archived surface review, computed-style sampling, visible component inspection, and official or public asset capture.",
    "evidenceStatus": "mixed",
    "verifiedSurfaces": [
      "current-redirect",
      "first-party-linked-social-profiles"
    ],
    "sourceAudit": "../../research/portfolio-live-evidence.json",
    "historicalStandaloneIdentity": true,
    "notes": [
      "Current domain redirects to BikeTiresDirect. Values come from the last first-party standalone homepage/CSS before consolidation.",
      "Current offers, inventory, prices, availability, service scope, and campaign copy are runtime data.",
      "The package is output-neutral; provider and renderer adapters belong outside it."
    ]
  }
}
