{
  "$schema": "../../brand-system-spec/v1/schemas/brand.schema.json",
  "schemaVersion": "1.0.0",
  "packageVersion": "1.0.0",
  "brand": {
    "id": "seattle-coffee-gear",
    "name": "Seattle Coffee Gear",
    "description": "Friendly specialty-coffee commerce with raspberry red, ocean blue, warm yellow, and condensed merchandising headlines.",
    "proposition": "Coffee equipment, beans, and practical education that help people make better coffee at home or work.",
    "audiences": [
      "Home espresso customers",
      "Coffee enthusiasts comparing equipment",
      "Beginners learning brewing",
      "Customers maintaining grinders and machines"
    ],
    "traits": [
      "knowledgeable",
      "friendly",
      "curious",
      "hands-on",
      "precise",
      "unpretentious"
    ],
    "signature": "Make coffee you love",
    "voiceSummary": "Warm coffee-nerd expertise. Explain technique and equipment clearly without gatekeeping."
  },
  "files": {
    "tokens": "tokens.json",
    "rules": "rules.json",
    "recipes": "recipes.json",
    "media": "media.json",
    "evaluation": "evaluation.json",
    "humanGuide": "DESIGN.md"
  },
  "modules": [
    {
      "capability": "interactive",
      "path": "modules/interactive.json"
    },
    {
      "capability": "static",
      "path": "modules/static.json"
    },
    {
      "capability": "imagery",
      "path": "modules/imagery.json"
    },
    {
      "capability": "commerce",
      "path": "modules/commerce.json"
    },
    {
      "capability": "marketing",
      "path": "modules/marketing.json"
    },
    {
      "capability": "motion",
      "path": "modules/motion.json"
    },
    {
      "capability": "generative-image",
      "path": "modules/generative-image.json"
    },
    {
      "capability": "generative-video",
      "path": "modules/generative-video.json"
    },
    {
      "capability": "spatial",
      "path": "modules/spatial.json"
    },
    {
      "capability": "sequential",
      "path": "modules/sequential.json"
    }
  ],
  "provenance": {
    "researchedAt": "2026-07-21",
    "method": "First-party live or archived surface review, computed-style sampling, visible component inspection, and official or public asset capture.",
    "evidenceStatus": "mixed",
    "verifiedSurfaces": [
      "current-homepage",
      "first-party-linked-social-profiles"
    ],
    "sourceAudit": "../../research/portfolio-live-evidence.json",
    "historicalStandaloneIdentity": false,
    "notes": [
      "Rendered live Shopify homepage, computed styles, theme variables, and first-party CSS.",
      "Current offers, inventory, prices, availability, service scope, and campaign copy are runtime data.",
      "The package is output-neutral; provider and renderer adapters belong outside it."
    ]
  }
}
