{
  "$schema": "../../brand-system-spec/v1/schemas/brand.schema.json",
  "schemaVersion": "1.0.0",
  "packageVersion": "1.0.0",
  "brand": {
    "id": "trisports",
    "name": "TriSports",
    "description": "Legacy triathlon specialty commerce with magenta-red urgency, endurance blue, orange accents, and compact Open Sans UI.",
    "proposition": "A historically specialist triathlon identity spanning swim, bike, run, endurance equipment, and athlete guidance.",
    "audiences": [
      "Triathletes",
      "Endurance athletes",
      "First-time race participants",
      "Customers comparing multi-discipline equipment"
    ],
    "traits": [
      "endurance-led",
      "technical",
      "focused",
      "supportive",
      "multidiscipline",
      "performance-minded"
    ],
    "signature": "Swim. Bike. Run.",
    "voiceSummary": "Supportive endurance expertise that connects equipment decisions across all three disciplines."
  },
  "files": {
    "tokens": "tokens.json",
    "rules": "rules.json",
    "recipes": "recipes.json",
    "media": "media.json",
    "evaluation": "evaluation.json",
    "humanGuide": "DESIGN.md"
  },
  "modules": [
    {
      "capability": "interactive",
      "path": "modules/interactive.json"
    },
    {
      "capability": "static",
      "path": "modules/static.json"
    },
    {
      "capability": "imagery",
      "path": "modules/imagery.json"
    },
    {
      "capability": "commerce",
      "path": "modules/commerce.json"
    },
    {
      "capability": "marketing",
      "path": "modules/marketing.json"
    },
    {
      "capability": "motion",
      "path": "modules/motion.json"
    },
    {
      "capability": "generative-image",
      "path": "modules/generative-image.json"
    },
    {
      "capability": "generative-video",
      "path": "modules/generative-video.json"
    },
    {
      "capability": "spatial",
      "path": "modules/spatial.json"
    },
    {
      "capability": "sequential",
      "path": "modules/sequential.json"
    }
  ],
  "provenance": {
    "researchedAt": "2026-07-21",
    "method": "First-party live or archived surface review, computed-style sampling, visible component inspection, and official or public asset capture.",
    "evidenceStatus": "mixed",
    "verifiedSurfaces": [
      "current-redirect",
      "first-party-linked-social-profiles"
    ],
    "sourceAudit": "../../research/portfolio-live-evidence.json",
    "historicalStandaloneIdentity": true,
    "notes": [
      "Current domain redirects to Competitive Cyclist. Values come from a May 2026 first-party archived homepage and its standalone CSS.",
      "Current offers, inventory, prices, availability, service scope, and campaign copy are runtime data.",
      "The package is output-neutral; provider and renderer adapters belong outside it."
    ]
  }
}
