{
  "$schema": "../../brand-system-spec/v1/schemas/brand.schema.json",
  "schemaVersion": "1.0.0",
  "packageVersion": "1.0.0",
  "brand": {
    "id": "competitive-cyclist",
    "name": "Competitive Cyclist",
    "description": "High-performance cycling commerce with race-day precision and a disciplined red signal color.",
    "proposition": "Enthusiast-grade bikes, components, apparel, and technical guidance for riders optimizing real performance.",
    "audiences": [
      "Experienced road, gravel, and mountain riders",
      "Riders comparing high-value technical equipment",
      "Competitive and performance-focused cyclists",
      "Customers building or upgrading bicycles"
    ],
    "traits": [
      "precise",
      "technical",
      "fast",
      "disciplined",
      "informed",
      "performance-led"
    ],
    "signature": "Race-day precision",
    "voiceSummary": "Informed rider-to-rider expertise. Specific about discipline, geometry, compatibility, and performance without empty hype."
  },
  "files": {
    "tokens": "tokens.json",
    "rules": "rules.json",
    "recipes": "recipes.json",
    "media": "media.json",
    "evaluation": "evaluation.json",
    "humanGuide": "DESIGN.md"
  },
  "modules": [
    {
      "capability": "interactive",
      "path": "modules/interactive.json"
    },
    {
      "capability": "static",
      "path": "modules/static.json"
    },
    {
      "capability": "imagery",
      "path": "modules/imagery.json"
    },
    {
      "capability": "commerce",
      "path": "modules/commerce.json"
    },
    {
      "capability": "marketing",
      "path": "modules/marketing.json"
    },
    {
      "capability": "motion",
      "path": "modules/motion.json"
    },
    {
      "capability": "generative-image",
      "path": "modules/generative-image.json"
    },
    {
      "capability": "generative-video",
      "path": "modules/generative-video.json"
    },
    {
      "capability": "spatial",
      "path": "modules/spatial.json"
    },
    {
      "capability": "sequential",
      "path": "modules/sequential.json"
    }
  ],
  "provenance": {
    "researchedAt": "2026-07-21",
    "method": "First-party live or archived surface review, computed-style sampling, visible component inspection, and official or public asset capture.",
    "evidenceStatus": "mixed",
    "verifiedSurfaces": [
      "current-homepage",
      "first-party-linked-social-profiles"
    ],
    "sourceAudit": "../../research/portfolio-live-evidence.json",
    "historicalStandaloneIdentity": false,
    "notes": [
      "Live site returned human verification; values are taken from the first-party archived homepage Chakra theme.",
      "Current offers, inventory, prices, availability, service scope, and campaign copy are runtime data.",
      "The package is output-neutral; provider and renderer adapters belong outside it."
    ]
  }
}
